{
  "$schema": "https://ebus.energy/schemas/device-profile.json",
  "schema_version": "property-schema-v1",
  "kind": "device-profile",
  "device": "energy.ebus.device.circuit",
  "version": "0.4",
  "status": "DRAFT",
  "date": "2026-08-20",
  "device_types": {
    "energy.ebus.device.circuit": {
      "capabilities": {
        "breaker": {
          "catalog": "energy.ebus.capability.breaker",
          "catalog_version": "0.2",
          "req": "MAY"
        },
        "connection": {
          "catalog": "energy.ebus.capability.connection",
          "catalog_version": "0.2",
          "req": "SHOULD"
        },
        "info": {
          "catalog": "energy.ebus.capability.info",
          "catalog_version": "0.3",
          "req": "MUST"
        },
        "load-shed": {
          "catalog": "energy.ebus.capability.load-shed",
          "catalog_version": "0.3",
          "req": "MAY"
        },
        "meter": {
          "catalog": "energy.ebus.capability.meter",
          "catalog_version": "0.3",
          "req": "MAY"
        },
        "pcs": {
          "catalog": "energy.ebus.capability.pcs",
          "catalog_version": "0.3",
          "req": "MAY"
        },
        "switch": {
          "catalog": "energy.ebus.capability.switch",
          "catalog_version": "0.2",
          "req": "MAY"
        }
      }
    }
  }
}
